股票代码,券商简称,发布日期,研报标题,报告链接,研报文本,研究员
600806,中国银河证券股份有限公司,2009-01-05,昆明机床(600806)：研发创新能力强 成长性突出,https://stock.finance.sina.com.cn/stock/go.php/vReport_Show/kind/search/rptid/284484597265/index.phtml,"国家出台的增值税改革及配套措施以及4万亿投资等“保增长”措施，对于拉动机床行业的需求、加快行业进口替代进程将起到明显的促进作用。我们认为未来机床行业将从目前状态逐步回暖，预计2009年行业增长17%-20%。重型机床的附加值高、竞争相对缓和、技术和进口替代空间大，一直是机床行业增长的最重要推动力，预计2009年重型机床增长不低于30%。
产品研发创新能力强，成长性突出，公司自主开发落地式镗铣床，近年来持续高速增长，已成为公司收入和利润占比最大的产品。是公司业绩高速增长的重要推动力。未来公司还推出龙门加工中心等高端新产品，形成新的增长点。公司的中高端产品比例高，盈利能力高于同行业上市公司，也高于主要竞争对手武重和齐二机床。
公司落地镗铣床属于重型机床，市场占有率为30%，目前订单应接不暇的局面有所缓和。预计下半年增速为30%左右，全年增速为40%。2009年增长28%。卧式镗铣床是公司的传统优势产品，市场占有率约为20%，目前小型号产品增速呈现大幅回落。预计2008年下半年的增速为10%，全年增长28%左右。2009年增速为18%。
预计2009年公司收入增长22%，毛利率将略有下降。公司盈利增长20%左右，2008年-2010年每股收益分别为0.63元、0.75元和0.95元。与同行业公司相比，公司估值优势明显，根据绝对估值和相对估值，公司的合理估值为9.5元，维持“推荐”评级。",周浩
000028,天相投资顾问有限公司,2009-01-05,一致药业(000028)：出售零售业务 聚焦分销、工业,https://stock.finance.sina.com.cn/stock/go.php/vReport_Show/kind/search/rptid/284484476483/index.phtml,"盈利预测与投资评级。根据此次收购与出售资产的情况，我们维持08年的EPS为0.55元，将09年的EPS从0.72元上调为0.80元，上调幅度为11%；将10年EPS从0.87元上调为0.93元，上调幅度为6.5%。维持公司的""增持""投资评级。
风险提示。（1）近一个月公司股价涨幅达到29.72%，同期大盘涨幅仅为-2.69%，国药股份涨幅为11.51%，所以公司股价可能存在短期回调可能。（2）公司收购资产后，还存在不能迅速磨合产生显著协同效应的风险。（3）大盘系统性风险。",张炎
601666,招商证券股份有限公司,2009-01-05,平煤股份(601666)调研简报：较高的分红收益率和低于重置成本的价格凸现价值,https://stock.finance.sina.com.cn/stock/go.php/vReport_Show/kind/search/rptid/284483217671/index.phtml,"维持“审慎推荐”评级
公司权益核定产能2849万吨（考虑在建煤矿，扣除持股60%的首山一矿的少数股东权益），按照大约400 万吨形成一吨产能计算，公司的重置建矿成本为11元/股。另外公司的采矿权重置成本为2.3 元/股（扣除未支付采矿权价款的一、四、六、八、十一矿和首山矿，按照5.5 元/吨的可采储量计算），企业重置成本合计为13.3元/股，目前股价仅高于重置建矿成本13.5%，且低于重置企业成本6%。
2005 年股东大会审议通过的现金分配政策为：每年对股东的现金股利分派不少于公司经审计的当年实现的可供股东分配利润的50%。按照08 年和09 年盈利的50%计算（扣除10%的公积金），目前股价下的分红收益率分别为8.1%和5.4%。
由于需求增速下降，煤价面临较大的不确定性，我们维持对公司审慎推荐的投资评级。",郭海燕
600276,国联民生证券股份有限公司,2009-01-05,恒瑞医药(600276)调研简报：期待“创新药”的起航,https://stock.finance.sina.com.cn/stock/go.php/vReport_Show/kind/search/rptid/284480879592/index.phtml,"投资建议：
对于恒瑞医药这样的企业其优势，我们不言而喻。但是对于未来我们也有些许的担忧，公司在过去凭借着“首仿”、“大市场、大病种”及“技术壁垒”，在抗肿瘤仿制药领域开创了自己的天地。那未来呢？公司开始渐渐感受到了首仿药市场的竞争压力，转向“创新药”，并从抗肿瘤产品积极向心血管和手术后产品进军。单纯从心血管领域的竞争来说，绝不亚于抗肿瘤类产品，而且在各个细分领域都存在着各自的强势品种，凭借公司目前的产品，难度可见一斑。而我们都知道创新药的研发即使是在国际大型医药企业来说，很多时候也是吃力不讨好的事情。公司未来三年的成长主要还是依靠仿制药来依托，预计在30%左右的幅度。
我们预测公司2008-2010年的每股收益分别是0.96元、1.27元和1.67元。2009年的市盈率是30.32X，相对于医药行业整体16X，化学制剂13X，略显昂贵，但是考虑到公司长期快速的增长，创新药的开拓者，我们愿意赋予公司一定的溢价。因此基本赞同市场目前的估值水平。给予“谨慎推荐”评级。",衡昆/章小韩
600426,华泰联合证券有限责任公司,2009-01-05,华鲁恒升(600426)：煤炭降价巩固成本优势,https://stock.finance.sina.com.cn/stock/go.php/vReport_Show/kind/search/rptid/284469915077/index.phtml,"粉煤降幅高于预期
公司每年与神华签订粉煤年度合同。08 下半年，由于合同以及神华定价等原因，公司粉煤采购价一直维持在较高水平（含税760 元/吨）。与此同时，块煤价格跌幅较大，山东地区块煤到厂价从年中最高1300-1400 元/吨下降到1000 元/吨以下（含税）。粉煤、块煤差价收窄至200 元/吨水平，创历年新低，公司成本控制能力也受到制约。
从历史上看，粉煤、块煤的合理差价在350 元/吨左右，神华的粉煤价格相对高估，有降价压力。不过此次降幅高达165 元/吨，与块煤价差达到400 元/吨左右，仍显著高于市场预期。
成本同行业最低
以尿素为例，公司水煤浆系统尿素生产成本大概为1450 元/吨，与行业普通煤头企业相比，差距拉大到约200 元/吨。其他产品如DMF 也有类似成本竞争力。
由于公司优秀的技术能力和管理水平，这一领先水平是可以持续的。
优秀的抗风险品种
08 年化工行业景气下滑，华鲁恒升是防御性最强的投资品种。公司的抗风险能力来源于3 方面：
1、 可持续的成本控制能力。公司成本优势来自于技术、运营和管理等诸方面，至少在未来3 年内，不会有明显威胁。低成本保证了即使行业低潮也有合理利润，更可贵的是保持高开工率和企业良好的运行状态。
2、 多行业、多品种的产业链优势。醋酸项目投产后，公司主要产品将有尿素、DMF、醋酸、甲胺等，产业链的一体化优势为国内煤化工最佳水平。下游行业既有稳定的粮食，也有周期性的服装、饲料等，整体经营风险较低。
3、 稳健的财务水平。在行业低潮、盈利能力下降的化工周期，快扩张、高杠杆的冒进型企业风险最大",朱力军
600517,中国国际金融股份有限公司,2009-01-05,置信电气(600517)：置信电气获得大额订单 维持推荐,https://stock.finance.sina.com.cn/stock/go.php/vReport_Show/kind/search/rptid/284469602233/index.phtml,"1．新年伊始“电网投资＋节能降耗”两辆马车强势初显。江苏帕威尔电气是江苏省电网公司的关联企业，也是置信江苏子公司（帕威尔置信）的合资方，其采购意向代表了江苏电网的投资计划。这笔10 亿元的09 年大额采购协议税后金额为8.5 亿元，已接近置信08 年全年来自江苏的销售收入（8－10 亿元），占我们09 年全年销售收入预测的27%。而且我们认为这还不是江苏电网09 的全部采购量，预计置信后续还可获得来自江苏的订单。
2．本次采购中置信的市场占有率仍占绝对优势。估计此次江苏电网集中招标中，置信电气获得了90%的非晶合金变压器订单，另一家电网关联企业获得剩余部分。
3．产品层次更为丰富。根据此协议，置信电气将在09 年为江苏电网提供20kV 的产品，在原有10kV 等级基础上取得突破。这一协议也缓解了市场之前的一个忧虑，即江苏电网新建20kV 线路，较高的电压等级降低了采购节能产品的必要性。
4．08 年经营现金流获得改善。我们估计该协议的预付款3 亿元已在08 年底前到帐，大大改善了置信08 年的经营性现金流状况（前3 季度为-2.3 亿元）。
维持推荐评级。股价对应09 年市盈率为21 倍，处于中金覆盖输配电设备板块估值的低端。公司双重受益于配电网投资加速以及节能降耗力度不减，是一个成长周期更长的输配电设备公司。考虑到需求强劲以及行业地位卓著，维持推荐评级",苏平/林周勇
600362,中国银河证券股份有限公司,2009-01-05,江西铜业(600362)：产量损失影响有限 短期业绩风险将释放,https://stock.finance.sina.com.cn/stock/go.php/vReport_Show/kind/search/rptid/284467947467/index.phtml,"投资建议
在2009年铜价30000元/吨的假设下，我们预测江西铜业2008、2009年EPS分别为0.73、0.41元，目前A股股价9.98元，对应2008年PB1.51倍，虽然距极限估值仍有距离，但已接近A股历史的最低估值，已低于我们计算的平滑掉周期影响江铜平均ROE决定的合理估值。虽然短期我们认为由于业绩亏损的风险还未完全释放，仍维持公司“中性”评级，但我们认为在风险释放后从长期回报的角度考虑可战略性布局。",周卓玮
002100,申万宏源集团股份有限公司,2009-01-05,天康生物(002100)调研报告：动物疫苗和饲料“双轮”驱动 具有高成长性预期,https://stock.finance.sina.com.cn/stock/go.php/vReport_Show/kind/search/rptid/284467926812/index.phtml,"2008 年业绩增长来自疫苗业务收入增加。2007 年公司销售各类疫苗4.7 亿毫升（其中口蹄疫疫苗3.6 亿毫升），2008 年预计公司销售疫苗5.7 亿毫升（其中口蹄疫疫苗近4 亿毫升），销量和收入预计同比增长20%以上。同时公司以往年份因结算周期原因，疫苗收入有部分在第二年确认，而08 年公司实现了当年结算。假设以往每年有15%疫苗销量在次年结算，则公司08 年可增加当年收入约2500 万元。当年结算也是公司08 年业绩增长的重要原因。
2009 年业绩明确增长来自于饲料产能扩张和景气恢复。2009 年公司饲料产能扩张，将推动该业务盈利增长100%以上：1）合并新子公司2009 年全年利润。
2008 年，公司本部饲料产量约为29 万吨，而新购并的宏展实业和郑州开创饲料子公司销量约35 万吨，净利约2300-2400 万元。公司在08 年11 月中完成100%股权并购。根据会计准则规定，当年仅合并其12 月份单月净利，而2009年将合并其全年净利润，公司同比增加盈利2 千万元以上；2）公司喀什年产6 万吨饲料项目预计2009 年8 月投产，预计09 年可能增加净利润100 万元左右；3）随着豆粕鱼粉等饲料原料价格下跌，饲料行业景气恢复，公司饲料业务毛利水平有望提高。
投资评级：增持。我们预计2008-2010 年，公司营业收入为9.24 亿元、17.13亿元和19.22 亿元，实现归属于母公司的净利润分别为0.70 亿元、0.96 亿元和1.10 亿元，按股本计算EPS 分别为0.56 元、0.76 元和0.87 元。公司激励体制灵活有效，疫苗销售拓展顺利，饲料产能大幅扩张，有望享受疫苗行业发展和饲料业景气恢复的双重利好。公司机制灵活高效，具有明确的高成长性，考虑到目前仅09 年15 倍PE 水平，我们给予“增持”评级。
风险因素：动物疫苗市场竞争激烈，如果销售价格和市场份额下降将影响公司业绩。如果因生猪、禽类市场出现供过于求，价格大跌降低存栏量，将减少饲料需求，对公司饲料业务构成一定风险。",王鹏
000021,中国国际金融股份有限公司,2009-01-05,长城开发(000021)：公告09年1季度硬盘板卡订单,https://stock.finance.sina.com.cn/stock/go.php/vReport_Show/kind/search/rptid/284465510171/index.phtml,"1Q09 硬盘板卡订单同比下滑12%
4Q08 订单完成情况低于预期。08 年第4 季度，公司实际完成PCBA 订单1327 万只，比预计订单减少29.5%，比3Q08 实际完成订单（2014 万只）减少34.1%，这符合我们在公司3 季报点评中的判断“全球经济放缓导致的需求压力上升，也将给公司接受代工订单带来负面影响”。
1Q09 预计订单同比减少12%。09 年1 季度，希捷给予公司的PCBA 计划订单为1442 万只，同比去年1 季度实际完成订单下滑12%，主要因为面对需求并不乐观的2009，希捷等下游客户对订单的发出更为谨慎。
维持盈利预测，维持“中性”投资评级
我们盈利假设中已经考虑到4Q08 和1Q09 硬盘板卡订单下滑的影响，故维持08-10 年每股收益为0.32 元、0.32元和0.35 元，当前股价对应09 年PE 为12.7x，PB 为1.0x，处于板块估值的中低端，但考虑到09 年外部需求的不确定性，暂时维持“中性”投资评级。",金宇
600584,海通证券股份有限公司,2009-01-05,长电科技(600584)调研报告：行业下行 成长模式难以为继,https://stock.finance.sina.com.cn/stock/go.php/vReport_Show/kind/search/rptid/284465019842/index.phtml,"电子行业需求同步金融危机节奏，亦步亦趋的恶化。淡季提前来临，需求恶化程度高于此前预期，由于需求恶化是全球性的，电子业颓势已经形成，最近政策利好难改下行趋势，预期下行趋势可能延续到2Q09，但何时回升及幅度还未可知。
封装产业趋势和长电状况：1）公司开工率逐渐降低。分立器件的开工率降低到5~6成左右，集成电路封装的开工率目前在7~8 成左右；2）2007 年分立器件贡献主营收入和主营利润的56%和66%，集成电路分别对应39%和30%；3）收入：1Q08和2Q08 同比成长，但是3Q08 和去年同期持平；4) 毛利率：1Q08~3Q08 期间的三个季度毛利率节节下降，与2007 年同期的季度毛利率节节上升形成鲜明对比。
IC 封装产业的特征。1）重资产”特征：“收入/固定资产净值”在行业最低端波动；2）技术进步特征：核心在工艺开发和设备，科研重要性上升，一线生产员工重要性降低，产品技术进步特征可以拉动毛利率成长；3）原料占比在60%以上，降低成本是行业发展趋势；4）设备通用性强，共用性强，产能综合拉动效应明显。
过去4 年公司成长归因。1）需求：过去几年需求周期向上，这是公司成长大前提；
2）融资投资：长电作为重资产公司，一切都需投资支撑，融资（银行贷款和资本市场融资）周期和投资周期和向上的需求经济周期吻合；3）投资向中高端顺利转型，投资有成效，产品技术进步明显，使产品均价相对稳定，毛利率逐年上升，导致成长；4）公司民营体制和灵活用人是必要条件；5）FBP 等新品不是成长主力，最近的CMMB 和U 盘等整机品的利润拉动作用还有待观察。
成长模式：具有依赖投资的重资产特征，而技术进步是外在现象，成长内生性弱，长期成长性有待考验。
盈利预测与投资建议。基于行业下行、公司技术进步作用弱化、所得税降低的假设，预期长电科技2008~2010 的对应EPS 分别为0.12 元、0.10 元和0.11 元，给予“中性”的投资评级。
主要不确定因素。行业下降低点和回暖时间点，新品对利润的拉动效果，直接面对国际企业的竞争",邱春城
000858,国金证券股份有限公司,2009-01-05,五粮液(000858)：历史问题逐步解决增厚2009年业绩,https://stock.finance.sina.com.cn/stock/go.php/vReport_Show/kind/search/rptid/284464652625/index.phtml,"对于五粮液公司我们认为市场对其有一定分歧，这与公司历史所遗留问题有着密切关系，如果对公司这些基本情况较了解且能接受，我们认为五粮液品牌影响力及在消费者心目中的地位，使得我们不应轻易否认其价值。
2008 年五粮液的营销策略重点：一是提升核心品牌“五粮液”的形象和竞争力；二是重点发展五粮液老酒和1618；三是系列品牌加强团购。2008年，公司的团购等新业务正如我们所判断一样出现快速增长。
公司09 年确定工作目标有：高价酒控量保价、并进一步扩大五粮液老酒和1618 在高价酒销量中所占比重、巩固并提升以五粮春和五粮醇为代表的优势中价酒品牌销量，推出六和液（零售定价398 元/瓶）以填补300-500 元/瓶出厂价区间内的产品空白，针对专卖店主销五粮液 1995，公司还将新推出生产酱香型酒。其中重点工作：一是高价酒销量保万吨，二是总体销售收入同比增长20%。
我们预测五粮液公司2008、2009、2010 年每股收益分别为0.488 元、0.702 元、0.835 元，所对应市盈率分别为27.03、16.76、13.45 倍。根据相对和绝对估值法我们确定公司的目标价为14.89-16.73 元。
2009 年酒类资产注入以及进出口公司价差缩小能增厚公司的业绩，因此我们继续维持对公司买入评级。",陈钢
600115,凯基证券集团,2009-01-05,东方航空(600115)：注资改变经营局面 扭亏还待市场转暖,https://stock.finance.sina.com.cn/stock/go.php/vReport_Show/kind/search/rptid/284462354859/index.phtml,"公司评价与投资建议
综合而言，本次注资从根本上改变公司经营窘迫的局面，使公司有足够的现金流在购置飞机和航线经营上有斡旋余地。但是公司运营角度看，尽管油价下调幅度超出市场预期，未来航油仍有下调空间，但是公司国际航线仍受国际金融危机影响，明年不会有大的作为，而国内航线则被南航和其它民营航空公司挤压，处在一个夹缝之中。根据本次油价调整，我们调价公司08-10 年EPS分别为，-0.62，-0.12 和-0.07 元。在公司完成重组之前，我们保守认为明年公司仍将处于一个亏损的状态，并持续关注公司重组动向，暂不做评级。",王志霖/翁佳梁
000932,东方证券股份有限公司,2009-01-05,华菱钢铁(000932)调研报告：投资未来精品战略,https://stock.finance.sina.com.cn/stock/go.php/vReport_Show/kind/search/rptid/284461493108/index.phtml,"近期生产经营：国内钢价的持续下跌对公司4 季度业绩形成一定压力，湘钢、衡钢因为宽厚板、无缝钢管下跌相对滞后、高毛利特性在四季度略有盈利，涟钢由于高库存和热轧板卷的抗风险能力较差会出现一定程度的亏损。
定向增发：募集资金的投资项目今年已经投资，大概明年一季度、上半年可以陆续投产，业绩的增长保证了不会摊薄业绩。公司定向增发完成后，华菱湘钢、华菱涟钢成为公司的全资子公司，对业绩也有一定的增厚。
安米的影响：公司主要在技术、人力资源、公司管理和发展战略上和ArcelorMittal 展开了深入的合作，在AM 的影响下，华菱将在战略上注重客户关系管理，有志于从一个生产商成长为综合服务商。
新建在建产能：未来三年公司的新建产能和产品结构调整，主要包括湘钢5M 宽厚板项目，涟钢2250 热轧工程和特大口径无缝钢管，2008 年因为雪灾和停限产钢材产量较07 年略有下降，2009 年新增钢产量约80 万吨，主要集中于高端产品。从2009 年开始基本恢复生产，加紧建设重大战略项目，通过多种手段改善财务状况，实现产品结构的优化升级，实现底谷时搞建设、高峰时高盈利的目标。
综合而言，因为具备一定的产品结构优势，且对库存的控制相对较好，在此轮钢价下跌中，华菱表现出的盈利防守性要高于行业平均，我们预计4季度公司基本盈亏平衡，但出于会计处理上的谨慎性原则，考虑到计提存货跌价损失之后，公司4 季度每股收益亏损0.07 元左右，全年业绩为0.38元。
虽然国内多数大型钢企都在进行产品结构的优化升级，但在国内钢铁公司中，华菱产品结构调整最值得期待，因为公司可以获得更直接更成熟米塔尔技术的支持，，通过与木米塔尔在汽车板、电工钢和造船板的全面深入合作，相信华菱钢铁在未来将成为国内少数拥有高端产品结构公司之一，具备更稳定的产品盈利结构和抗周期性。
我们预计2008 年、2009 年华菱管线将实现每股收益0.38 元和0.36 元，考虑到2009 年后公司在产品结构上体现出的竞争力和盈利的稳定性，目前已经低于净资产的股价已经具备足够的吸引力，维持增持评级。",杨宝峰/徐卫
600166,华泰联合证券有限责任公司,2009-01-05,福田汽车(600166)：抢占新能源汽车先头阵地,https://stock.finance.sina.com.cn/stock/go.php/vReport_Show/kind/search/rptid/284457416609/index.phtml,"据有关媒体报道，12 月28 日，福田汽车与北京市公交集团签订了800 辆混合动力城市客车整车及底盘的采购协议，以公司为中心的北京新能源汽车设计制造产业基地正式落户福田汽车昌平厂区。
由于北京的特殊地位，预计未来节能减排的推进力度将逐渐加强，新能源汽车的推广力度值得期待。而福田凭借其地缘优势，未来在以北京为中心的华北地区可能优势较大。
由于本次采购具体细节尚未公布，因此究竟能带来多少业绩的提升目前尚难判断，更多的是标志着政府新能源汽车推广进入实施阶段。
城市公交由于其对蓄电池的体积、重量要求较低，行驶路况和环境比较稳定，车速较低，是目前中国开发最成熟，应用前景最好的车型。而考虑到充电地点集中稳定，政府财政支持最易实现，示范作用明显等因素，随着2009 年科技部推广计划的实施，未来两年可能是推广应用的重点。
随着新能源公交推广政策的逐步明朗，以混合动力客车和更先进的纯电动客车为核心，关注产业链上相关受益公司，涉及整车、蓄电池、驱动电机、上游资源等。（详见我们12 月25 日的《谁能分享低碳经济下的汽车盛宴——浅析新型动力汽车》）",姚宏光/黄未樵
601628,海通证券股份有限公司,2009-01-05,中国人寿(601628)续展关联交易点评,https://stock.finance.sina.com.cn/stock/go.php/vReport_Show/kind/search/rptid/284457279093/index.phtml,"投资建议。中国人寿经营依然非常稳健，相比中国平安和中国太保具备三方面优势：（1）没有高利率保单，资金成本相对最低；（2）每股浮亏相对最低；（3）债券投资的久期显著长于同业，更易应对持续较长的低利率环境。但从估值来看，公司股价明显偏贵。
在5%投资收益率、15 倍新业务倍数和11.5%贴现率假设下，中国人寿对应2008 年底估值为15.7 元。目前公司股价为18.58 元，对应4.2 倍PB 和20.6 倍隐含新业务倍数，显著高于主要竞争对手，我们仍维持“中性”投资评级。
主要风险。主要风险包括较低的年报业绩（对应非常高的P/E）风险、明年继续大幅减息对保险股利空、一季度保费很可能出现大幅负增长。",潘洪文
