股票代码,券商简称,发布日期,研报标题,报告链接,研报文本,研究员
600837,国泰君安证券股份有限公司,2009-01-16,海通证券(600837)：交易额持续回暖,https://stock.finance.sina.com.cn/stock/go.php/vReport_Show/kind/search/rptid/285418310718/index.phtml,"投资要点：
12月份经纪业务持续回暖、承销业务依旧空白。公司12月完成股票基金权证交易额2325亿元，同比下降19.3%，环比增长10.8%、超越了市场4.5%的增幅，当月约实现佣金收入2.9亿元，同比下降8.2%。受市场权证交易整体萎缩推动，公司股票基金权证市场份额4.1%，较上月增加0.24个百分点。
季度经纪业务量止跌回升。4季度，公司完成股票基金权证交易额5798亿元，同比下降35.2%，但环比增长16%。预计4季度实现经纪佣金收入8.08亿元，同比下降10.7%，环比增长29.9%。4季度公司无股票公开发行以及债券发行项目。
2008年传统业务面临蛋糕缩小和份额下降的双重压力。2008年公司完成股票基金权证交易额29,841亿元，同比下降36.4%，市场份额4.36%，较去年下降0.09个百分点，全年约实现经纪佣金收入38.3亿元，同比下降33.5%。2008年公司投行业务退步明显，共完成7家股票公开发行，募集资金30.8亿元，较2007年下降94.5%，市场份额为1.83%，下降9.44个百分点。同时，在债券承销方面，公司也未能抓住债券发行市场爆发增长的机遇，全年仅发行1支企业债，募集资金6亿元，同比下降71.4%，市场份额仅0.18%，排名32位。公司全年约实现承销收入1.85亿元，同比下降49.9%。
全年业绩基本符合预期。2008年营业收入70亿元、净利润33亿元，同比分别降37.8%和39.5%。第4季度实现营业收入14.3亿元、净利润6.5亿元，同比分别减少51%和52%，但环比来看净利润增长1.3%，业绩下降的趋势开始有所减缓。需要指出的是，公司的费用压缩幅度低于预期，使得4季度营业利润率仅2.8%；而得益于所得税抵扣，才使得4季度净利润率达到45.5%，基本接近近两年来的正常水平。从这一角度看，我们难以对2009年的费用弹性和整体业绩抱有较为乐观的预期。
维持2009-2010年的业绩预期以及对公司的中性评级。公司目前的估值水平较中信并不具备优势，我们继续维持中性评级。",梁静/董乐
600054,华泰证券股份有限公司,2009-01-16,黄山旅游(600054)：“公司门票提价听证会将召开”公告点评,https://stock.finance.sina.com.cn/stock/go.php/vReport_Show/kind/search/rptid/285418262531/index.phtml,"公司股票1月15日停牌一天，公司证实黄山门票可能于2009年实现上调，需要对此重大事项发布公告。我们从公司了解到门票提价听证会可能于2月中旬召开，如能通过，具体提价将在2009年5月以后实行。
公司门票前次提价是在2005年6月，距今已有3年多的时间，按照发改委227号文件规定在2008年6月以后公司即可调价，调价上限在230元。但是由于905号文件的颁布，公司门票调价必须在2009年4月9日之后方可实行。
按照公司以往提价时机选在重要节假日之前实行的惯例，如果听证会议案通过，假设提价从今年5月开始实行，我们测算门票提价对公司2009年每股收益的贡献约为0.02元，影响微乎其微。
从另一个角度来看，我们对公司提出门票提价事宜提出一些疑问，尤其是在国内旅游行业经历了2008年的低谷并且2009年宏观环境并不乐观的条件下，门票提价时机是否合适。黄山门票提价后在短期内可能抑制游客的需求，减少入山人数，因此不排除公司再通过实施优惠票价等营销手段保证游客人数的增加，从而抵消了门票涨价对公司业绩可能带来的增长。
不论此次黄山门票提价能否实行，我们认为对公司当期业绩的影响不大，公司的基本面没有因此而发生变化，但短期内我们不能排除市场因此消息进行炒作带来的股价波动。在不考虑此次门票提价后的前提下，预期公司08-10年的每股收益分别为0.41元，0.50元，0.62元，我们依然看好公司发展的稳定性和成长性，维持长期""推荐""评级。",耿焜
600486,国信证券股份有限公司,2009-01-16,扬农化工(600486)：经济下滑影响不大 估值相对较低,https://stock.finance.sina.com.cn/stock/go.php/vReport_Show/kind/search/rptid/285418004375/index.phtml,"公司目标是争取09年业绩不出现滑坡：预计卫生用菊酯能够稳定增长（1位数增长）。农用菊酯09年形势还比较明朗，主要原因在于：首先，08年是近5年虫害最缓和的一年（一般虫害4-5年是一个周期），预计09年虫害可能会比较多；其次，09年即使保持08年气候情况，但出现雪灾的概率较低，甚至可能出现暖冬。当然，农用菊酯下游需求也存在不利方面，主要在于终端渠道中的存货从08年一直累积到现在。
我们预测2008~2010年EPS为1.70（17.65），1.74（17.24），2.06元(14.56)，作为一家得到普遍认可的农药龙头企业，目前在农药股中估值相对较低，维持“谨慎推荐”评级。",邱伟/陆震
002230,国信证券股份有限公司,2009-01-16,科大讯飞(002230)：全年业绩符合预期 4Q盈利增长39%,https://stock.finance.sina.com.cn/stock/go.php/vReport_Show/kind/search/rptid/285418003905/index.phtml,鉴于公司良好的发展势头，我们维持09、10年0.89元、1.20元的盈利预测，并维持“中性”评级。对于公司各项业务的具体情况，我们将待年报披露之后再做具体分析。,凌晨/王俊峰/肖利娟
601628,中国国际金融股份有限公司,2009-01-16,中国人寿(601628)：中国人寿公布了2008年中国会计准则下保费收入,https://stock.finance.sina.com.cn/stock/go.php/vReport_Show/kind/search/rptid/285418003452/index.phtml,基于可预见的保费收入增长放缓，与未来低利率环境下可能进一步降低的投资收益水平，我们维持对中国人寿A股“中性”和H股“减持”的投资评级。,周光
000778,国信证券股份有限公司,2009-01-16,新兴铸管(000778)：增值税返还进一步确保公司业绩,https://stock.finance.sina.com.cn/stock/go.php/vReport_Show/kind/search/rptid/285417451625/index.phtml,由于公司2008年第四季度存在一定的计提，我们继续维持公司2008年EPS为0.40元、2009年EPS为0.57元的业绩预测，对应PE分别为17、12倍，而其合理估值应在15倍左右，目标价位应在8.5元左右，较目前还有约25%的上涨空间。该公司的发展又恰好符合我们城市管网和基础设施建设的投资主题。因此，我们维持公司“推荐”评级。,郑东/秦波
600511,国信证券股份有限公司,2009-01-16,国药股份(600511)08年业绩快报：略超预期,https://stock.finance.sina.com.cn/stock/go.php/vReport_Show/kind/search/rptid/285417450515/index.phtml,09年～10年，商业板块比较稳定，虽由于08年3季度受奥运影响收入增速放缓，09年增速有望提升；工业的国瑞药业处于较快增长、国内依达拉奉的整体市场规模09年将接近8亿元，公司的产品增长空间较大，如果营销工作开展较快，有望实现较高增长；麻醉药工业企业青海制药的的投资收益09年将恢复性增长，宜昌人福继续处于快速增长期；加上明年贷款利率的下降，业绩也不乏上调空间。在兄弟公司一致药业率先进行了资产整合后，国药股份对国控北京站的整合仍可期待，维持“推荐”评级。,丁丹贺/平鸽
601601,中国国际金融股份有限公司,2009-01-16,中国太保(601601)：公布2008年中国会计准则下保费收入,https://stock.finance.sina.com.cn/stock/go.php/vReport_Show/kind/search/rptid/285417448718/index.phtml,"2008年12月太保财险实现保费收入19.6亿元，同比增长13.2%，略低于11月9.6%的增速水平。2008年1-12月，中国会计准则下未经审计的累计保费收入为278亿元，同比增长率由1-11月的19.1%小幅下滑至18.6%，远低于2007年29.4%的保费收入增长水平。
我们预计，2009年，显著趋缓的经济增长和持续低迷的新车销售可能会进一步打击财险业的保费收入增长，太保财险的保费收入增速也将随行业整体增长趋势的放缓而出现下滑，预计增长率将在15%左右。",周光
002161,海通证券股份有限公司,2009-01-16,远望谷(002161)：宏观影响大于预期 下调盈利预测及评级,https://stock.finance.sina.com.cn/stock/go.php/vReport_Show/kind/search/rptid/285417448187/index.phtml,"下调投资评级至""中性""。我们下调公司2008~2010年EPS分别为至0.47元、0.63元和0.79元。我们认为相对估值方法对于A股公司，特别是成长型公司更有意义。我们选择的四个A股可比公司08～09年平均PE分别约为25x和18x。与这些公司相比，公司所处行业成长的明确性高，尽管08年业绩增长低于预期，仍可以给予高于行业平均的估值水平。鉴于2009年将近，我们以25～30x的2009PE预测公司股票合理价值为15.75元～18.90元，6个月目标价为18.90元，目前估值水平较高，暂时下调投资评级至""中性""，但是我们仍然长期看好公司的成长性，如果估值趋于合理，将是良好的买入机会。
主要不确定因素。目前业绩高度依赖铁路行业，该业务收入波动性较大；早期信息化应用逐渐成熟，需要不断开拓新需求；非铁路行业RFID业务竞争力不明显，存在竞争加剧，毛利率下降风险。",李冠宇/陈美风
600435,招商证券股份有限公司,2009-01-16,中兵光电(600435)：注入军工资产盈利兑现 公司拟实施增发,https://stock.finance.sina.com.cn/stock/go.php/vReport_Show/kind/search/rptid/285415673250/index.phtml,"防务资产是公司未来主要发展方向：公司注入防务资产后，军民两用产品占总收入的77%。军品业务中，毛利率高的火箭弹远程控制系统依然是公司主要收入和利润来源，09年可以保持稳定，新的增长需要观察新型号的外销情况。其他军品短期内对公司整体业绩不会有显著影响。无人车在09年的交付将明显增加，预计可以到40辆左右。无人机在09年依然有一定的不确定性；
电脑刺绣机09年或将有新机会：在国家实施纺织业振兴计划的前提下，纺织业下滑趋势在09年将会明显改善，纺织业自身产业升级将增加对公司电脑刺绣机的需求。我们认为公司电脑刺绣机收入在09年会出现新的增长；
增发募集的资金将保证公司未来发展：公司计划通过增发募集8.02亿元用于公司智能机器人、无人机、远程控制、光电稳瞄四大防务业务板块的后续发展。我们看好公司募集资金的使用方向。公积金每10股转增10股的方案也配合了公司增发计划。据估算，此次增发价格区间为17.5-29元。增发是否顺利实施，关键在目前市场环境下，选择什么样的增发价格；
风险提示：低毛利率的油气仓储业务或将降低公司毛利率水平。新产品面临的技术和市场风险；
维持""审慎推荐-B""投资评级：我军在未来很长一段时间致力于提高信息化程度和精确打击能力。我们认为公司将继续受益，应该享受比普通制造业更高的溢价。预计09、10年的EPS分别为0.82、0.93元，按09年30倍PE估算，6个月目标价为23-24元。维持""审慎推荐-B""投资评级。",刘荣/王轶铭
600017,申万宏源集团股份有限公司,2009-01-16,日照港(600017)调研报告：09年业务量增速回落 机会在于预期好转,https://stock.finance.sina.com.cn/stock/go.php/vReport_Show/kind/search/rptid/285415339045/index.phtml,"2008年，日照港总吞吐量增长23%，较07年回落6个百分点。全年趋势前高后低，上半年同比增长40%，下半年同比仅增长8%。（1）吞吐量占比68%的铁矿石货种的进口量11月出现""休克""同比下降25%，12月同比下降45%。主要是由于铁矿石价格迅猛下降、钢铁需求骤降、巴西铁矿石谈判、日照钢铁调整库存及应对整合使得铁矿石需求和进口量下降。预计09下降趋势在一季度延续、三季度出现好转，由于自身自然和设施优势增速将高于沿海港口平均铁矿石增速水平，2009年全年增速在3%左右。（2）08年煤炭吞吐量同比增长18%，扭转了2003年以来持续下降的局面。主要是由于疏港铁路分配的运能增加，未来货运南通道若能批准投产，将打开长期煤炭吞吐量增长空间。
2008年三季度末港口基准费率上调并未实质执行，预计未来铁矿石装卸费率下调的空间和概率较小。随着铁矿石压港量的逐渐正常化，堆存收入09年也将恢复正常水平。
公司处在持续的建设阶段，资本支出带来折旧成本和财务费用逐年提高：09年主要的建设项目是西港区三期的散杂货泊位，09年资金需求约为4.5亿元，预计年底简易投产，将分别增加2010年折旧费用和财务费用3000和2000万元；矿石二期堆场工程09年一季度即将投入试运行，2008年全年约1.4亿的短途倒运费用在2009年有望大幅下降50%，同时也将使得折旧费用增加4500万元。
认购权证行权没有成功后，下一步将通过增发或借款通过银行借款收购集团西二期资产。收购带来费用的节省（租赁费用变为折旧和人工费用）和收入的增加（新增钢材业务收入置入上市公司），同时也会增加财务费用（借款收购）或摊薄股本（增发收购），预计总体将对公司EPS有所增厚。
维持增持评级。将08-10年全面摊薄的EPS从0.25，0.33，0.44元下调到0.18，0.20，0.22元。目前股价对应的09年PE为20倍，在港口中相对偏高。作为进口铁矿石的主要港口，业务量受到钢铁需求复苏的影响较大，弹性较好；作为港口行业，由于费率的稳定性而具有相对的防御性。未来投资机会在于（1）受到基础设施投资的拉动，铁矿石进口业务量增速预期的好转；（2）公司收购西港区二期对业绩的小幅增厚。预计09年一季度铁股份公司矿石进口量同比下降20%以上，而环比出现10%左右的复苏。一季度环比业务量和业绩的复苏，以及三月份底政府投资对铁矿石需求的带动会成为公司预期好转的催化剂。",周竞竞/李树荣
600054,申万宏源集团股份有限公司,2009-01-16,黄山旅游(600054)：若提价15%增厚业绩约0.04-0.05元 维持买入,https://stock.finance.sina.com.cn/stock/go.php/vReport_Show/kind/search/rptid/285415338234/index.phtml,"提价是否符合相关的基本规定：不仅符合国家发改委等有关门票提价的时间间隔规定，而且只要2009年4月8日之前不提价，则符合八部委发布的限涨令。
提价幅度可能会多少：目前黄山风景区执行的价格政策是旺季200元、淡季120元，根据相关规定，此次提价的幅度是不超过现价的15%，即旺季价最多提价至230元，淡季价最多提价至138元。
若最终获批，新价格政策何时有望开始实施：根据相关规定，若最终提价方案顺利通过价格听证，并获得价格主管部门的批准，则黄山风景区新价格政策最早也要到2009年4月9日之后。我们预计，若最终成功获批，则2009年5-6月有望开始实施。
若最终获批，并提价15%，将带来什么影响：提价对游客增长有一定的负面影响，但影响较小，预计未来游客仍有望保持快速增长。若提价15%，则增厚2009-2010年EPS约0.04-0.05元。
坚定看好中长期投资价值，维持""买入""评级。不考虑门票提价2008-2010年EPS分别为0.42元、0.53元、0.64元；若假设提价15%，则分别为0.42元、0.57元、0.69元。目前股价14.80元，对应2008-2010年的PE分别为35倍、26倍、21倍。我们维持""买入""评级，并坚定看好黄山旅游的未来发展前景和中长期投资价值。
风险提示：提价方案存在被否的可能性。",陈海明
600030,平安证券股份有限公司,2009-01-16,中信证券(600030)深度报告：难以撼动的龙头券商,https://stock.finance.sina.com.cn/stock/go.php/vReport_Show/kind/search/rptid/285414868311/index.phtml,"并非经营风险的中国证券行业：
①监管政策限制风险经营。②中信杠杆比率是国际同行的1/8。③中信风险资产占比是国际同行的1/3。④中信高风险级别收入占比不足1/3。⑤政策门槛造就行业高毛利。
公司龙头地位稳固：
①各项业务全面领先。除资产管理业务排名第3外，主要财务指标和业务指标均排名第1。
②此轮熊市难以撼动龙头地位。首先，公司拥有充足的资本金储备维系现有业务发展。其次，预计本轮熊市持续时间较短，其他券商难以通过并购实现超越。
③受益于清晰的发展战略。01年末至08年中期，公司剔除融资后的净资产复合增长率为36.2%。03～06年的“融资收购”战略，使经纪业务市场份额由11位跃至第1位。07年至今公司实行“国际化+创新业务”战略，目前是取得创新业务资格最多的券商，战略效果有望逐步显现。
预计09年EPS0.85元，BVPS9.18元。以上预测基于2009年日均股票成交额800亿元；全年股票融资额1334亿元；融资融券试点阶段依托券商自有资本金展开可增加EPS0.06元的假设。
维持“推荐”评级。公司近8年平均ROE为12%，针对09年2.2倍PB的估值水平，长期投资吸引力较低，但相对价值明显低估。公司目前PB仅高于处在解禁压力之中的海通证券，且接近自身历史最低估值。维持“推荐”。",邵子钦/田良
002214,申万宏源集团股份有限公司,2009-01-16,大立科技(002214)调研报告：军工带来高增长,https://stock.finance.sina.com.cn/stock/go.php/vReport_Show/kind/search/rptid/285414867750/index.phtml,"投资要点：
受益于国防开支的稳定增长，以及“军退民进”的政策，公司作为国内红外热像仪的民企龙头，军工业务将迎来高速增长。预计今年将新增1或2个型号，且有望从配套厂商向整机厂商转变。军工业务出货量增幅在40-85%，若成功采用整机形式出货，收入增速更将快于出货量，达70%-140%。
公司在边境、海防等领域的业务也进入了快速发展的阶段。在前期边海防项目的招标中，公司都有不错的斩获，预计将新增年收入3000万左右。
目前占公司另外2/3收入的民品和出口业务，我们预计将保持平稳增长。公司民品业务以电力企业为主，还涉及消防、煤炭等领域，下游行业受金融危机的影响较小，而且在民用领域中，红外热像仪的渗透率还处在较低水平。该领域在08年保持了25-30%左右的增长，我们保守预计09年整体增长降为10%左右。
从更长远看，我们看好未来公司突破核心零部件——焦平面探测器后产业地位的上升。目前焦平面探测器的采购主要来自法国厂商，而且需要法国政府的审批，这也限制了我国红外热像仪产业的发展。公司一旦能够实现批量生产，产业地位也将极大提高。目前，公司的焦平面探测器还在试制过程，预计要在2010年底实现量产。
我们预计2008-2010年的EPS为0.42，0.57和0.78元。鉴于公司良好的成长性，以及军工业务超预期的可能性较大，我们认为公司合理价格区间为14.25-17.1元，相当于09年25x-30xPE。目前股价合理，首次评级为增持。
投资风险：2009年2月份，将有3585万股小非解禁。",钟小辉/余斌
600704,中国银河证券股份有限公司,2009-01-16,中大股份(600704)：资产收购受诉讼影响延期,https://stock.finance.sina.com.cn/stock/go.php/vReport_Show/kind/search/rptid/285414867359/index.phtml,我们依然看好我国未来汽车服务市场的发展前景，但由于中大股份对物产元通的收购存在很大的不确定性，而且收购完成后，物产元通对中大股份的业绩贡献可能低于我们此前的预期，我们将公司评级下调为“中性”。,陈雷
002182,中国银河证券股份有限公司,2009-01-16,云海金属(002182)：多重因素影响四季度业绩,https://stock.finance.sina.com.cn/stock/go.php/vReport_Show/kind/search/rptid/285414866921/index.phtml,我们在2009年镁价16000元/吨的假设下，预测2008、2009年公司的EPS为0.323、0.777元，目前股价对应的市盈率分别为34.1、14.1倍，2008年PB2.33倍，经过最近的上涨股价已经接近我们给出的合理估值，但考虑镁行业未来的广阔发展前景及公司在经济复苏后业绩大幅增长的预期，我们继续给予公司“推荐”评级。,周卓玮
600511,申万宏源集团股份有限公司,2009-01-16,国药股份(600511)：经营业绩又超预期,https://stock.finance.sina.com.cn/stock/go.php/vReport_Show/kind/search/rptid/285414598093/index.phtml,"投资要点：
公司公告2008年业绩快报：08年实现营业收入43.85亿，实现净利润1.92亿，同比增长46.6%，每股收益0.80元，高于我们0.78元预期，净资产收益率23.2%。
经营继续保持较快增长：08年公司主营收入同比增长22.7%，符合我们预期，其中：①纯销08年同比增长超过30%；麻药分销和药品调拨虽然三季度受到奥运影响，但四季度恢复正常，两块业务08年增速均超过20%；医药工业和国药物流仍然保持较快增长；②投资收益：人福药业贡献投资收益增长约30%，青药集团表现与07年基本持平。
营业利润增速低于收入增速：08年营业利润同比增长12.7%，低于主营收入增速，原因有二：一是受部分供应商调低产品价格影响，公司08年毛利率略有下降，同比下降约1个百分点；二是08年公司碘的调拨财政部补助计入营业外收入，产生的费用计入营业费用，导致营业费用上升，与之前财政部补贴直接减少营业费用的财务处理有所不同。
净利润业绩高于预期：08年净利润同比增长46.6%，每股收益0.80元，高于我们0.78元预期，除主营收入平稳较快增长外，所得税也是一项影响因素：
一是08年公司所得税率由33%降为25%；二是07年子公司国药物流作为生产型外商投资企业获得15%的优惠所得税率，当期调减了递延所得税资产，这导致07年归属母公司净利润减少，故08年增幅较大。
2009年保持稳健较快增长，维持买入评级：2009年宏观环境虽然不确定，但公司分销的产品都是治疗性药品，需求刚性，我们认为公司仍可保持稳健较快增长。我们预计公司2009-2010年每股收益为1.03元、1.29元，同比增长28%、25%，公司09-10年预测市盈率分别为27倍、22倍，当前估值处于合理区间，考虑公司作为国控北方资产整合平台较为明确，股价具有较高安全边际，维持买入评级。",胡伯清/罗鶄
002122,中信建投证券股份有限公司,2009-01-16,天马股份(002122)：未来看点在于风电轴承和重型机床,https://stock.finance.sina.com.cn/stock/go.php/vReport_Show/kind/search/rptid/285413879405/index.phtml,"重型机床行业受宏观经济影响较小
在金融危机的影响下，我国机床产业出现了两极分化的局面。普通车床和经济型数控机床产品出现大批库存积压，低端产品销量明显下滑；而重型、精密、高速、多轴联动、复合化的高端数控机床的国内市场需求依旧保持上升态势。
齐重订单充足，费用率下降
齐重中小型产品市场占有率为70%，大型产品市场占有率在90%以上，产品的综合毛利率在24%左右。现在齐重数控手握订单35亿元左右，09年生产任务饱满。2008年前三季度齐重数控收入占比约40%，利润占比33%，成为名副其实的主要业绩贡献者之一。天马收购齐重后重视新产品开发，毛利率明显高于既有产品；
另外，从今年前三季度来看，齐重数控的期间费用率也有所下降。
风电轴承前景看好
公司是国内少数几家具备生产1.5MW级以上偏航和变桨轴承能力的企业之一，加工设备如数控立式车床和数控铣、滚、插齿机等可由齐重数控提供，与其它生产企业相比，公司占有设备上的优势。公司与东方汽轮机厂、金风科技、荷兰EWT等主机企业建立了良好合作关系。风电轴承业务毛利率约为50%，未来由于其它企业的竞争，毛利率会有所下滑，但下滑空间不大，我们预计至少在2009年和2010年，风电轴承的毛利率仍可保持在45%以上。预计09年风电轴承收入可达到9.3亿元以上。
盈利预测和评级
我们看好公司由于募集资金项目的快速投产带来的轴承内生式增长和轴承、机床收购带来的外延式扩张。公司主要生产基地均享受15%的优惠税率，预计公司未来两年公司所得税率将继续低于15%。预计齐重2008年~2010年的净利润分别为5.12亿、7.84亿和10.07亿元，EPS分别为1.88、2.64和3.39元（09和10年的EPS考虑了增发摊薄），合理价位为85元，“买入”评级。",冯福章/高晓春
