股票代码,券商简称,发布日期,研报标题,报告链接,研报文本,研究员
000800,中国银河证券股份有限公司,2009-01-12,一汽轿车(000800)：品牌定位清晰 产品谱系完善 期待整体上市,https://stock.finance.sina.com.cn/stock/go.php/vReport_Show/kind/search/rptid/285066998984/index.phtml,"公司未来将实行红旗+马自达+奔腾三大品牌共存的战略。三大品牌在定位上将覆盖高档、中档及中档向中低档延伸产品。旗下红旗品牌将定位于高端产品，马自达定位于B级车市场，而奔腾则定位在B级车中的中低端市场。我们认为定位清晰的三大品牌将有效支撑公司未来产品谱系的延伸，为丰富公司车型奠定基础，有效解决公司利润来源单一的问题。
2009年期待新车型推出后的表现。
睿翼是在马自达独立开发的全新高端平台上制造的新一代B级中高端产品。高端平台使得睿翼较老马6得以在高品质感、静肃性、安全性方面有所提高，市场定位提升。我们认为睿翼的整体质素较高，与主要竞争车型相比有诸多优势，未来能否在竞争中占据主导地位取决于产品定价是否具备竞争力。
B50是一汽轿车在奔腾B70平台上自主研发设计出来的一款产品，未来将与马6、B70共线生产。该车型使得公司产品谱系下探，有利于公司未来占领目前市场份额最大的一块市场。
我们预计公司在1.0L-1.6L市场的空白将通过奔腾品牌系列产品后续完善得到改观。借助奔腾品牌下产品的完善，公司产品谱系将成功下探至经济车型。我们采用三阶段估值模型，采用3%的永续增长率，12.07%的wacc，公司绝对估值的合理价值为8.22元。考虑到轿车子行业平均的估值水平以及一汽轿车的行业地位，我们认为公司合理的估值区间在15-17倍。按照2008年预测每股收益0.6元计算，对应每股价值在9-10.2元，维持对公司谨慎推荐的投资评级。",李丹
000776,平安证券股份有限公司,2009-01-12,S延边路(000776)：值得期待的上市进程-董正青泄露交易信息案件宣判点评,https://stock.finance.sina.com.cn/stock/go.php/vReport_Show/kind/search/rptid/285066353499/index.phtml,"广发上市有望继续推进。2009年1月9日天河区人民法院宣判董正青泄露交易信息罪名成立，检察机关把广发证券内幕交易案定性为董正青个人行为，内幕交易案件不涉及广发证券公司本身，由此推断广发证券借壳上市一事有望继续推进。
净资本不足已成为公司发展的制约因素。2008 年上半年，广发总资产规模是海通的86%，净利润是海通的103%，但净资本仅为海通的37%，净资本不足已经开始制约这个行业第4 大券商的发展。
经纪业务是公司主要利润来源。2008 年上半年，公司经纪佣金收入占比81%，利息收入占比8%；自营收入比7%；承销收入和资产管理收入分别占比2%和1%，其他业务收入占比1%。
承销项目“小而多”，熊市加重成本负担。2008年1～10月广发证券承销保荐收入中78%来自股票市场，承销家数排名行业第2，平均单个项目承销额位居10大券商之末，庞大的人工支出加重了公司成本负担。
不考虑增发因素，合理估值14.69～17.93 元/股。参考上市券商2009 年的估值水平，我们认为2009 年广发证券合理P/B 区间为2.09～2.55 倍。在不考虑增发的情况下，对应复牌后合理价值区间为14.69～17.93 元/股。
1. 公司业绩高度依赖证券市场，不排除短期业绩大幅波动的可能性。
2. 公司股权回购、股改、吸收合并方案有待证监会审批，存在不确定性。",邵子钦/田良
600030,申万宏源集团股份有限公司,2009-01-12,中信证券(600030)：可供出售金融资产减值损失降低08年EPS0.09元,https://stock.finance.sina.com.cn/stock/go.php/vReport_Show/kind/search/rptid/285066296359/index.phtml,"公司公告修改会计政策议案，对现行会计政策中可供出售金融资产减值准备的计提政策进行补充，对公允价值跌幅超过持仓成本50%的单项可供出售金融资产计提减值准备。方案在董事会通过后，自2008 年度报告起执行。
对可供出售金融资产计提减值准备，将在公司所有者权益中体现的浮动亏损，计入当期损益。可供出售权益工具投资发生的减值损失，不得通过损益转回，但可以当该可供出售金融资产出售后，冲回已确认减值损失。
会计政策修正进一步提升业绩披露质量、真实反映当期经营状况。由于2008年证券市场大幅下跌，券商自营业务业绩受到了较大程度的拖累，而“交易性”和“可供出售”金融资产的划分则使得券商通过会计科目实现利润调控成为可能。公司本次会计政策的调整不仅进一步体现了计量的谨慎性原则，而且有助于真实反映当期经营状况。
从几家上市券商对债券、基金投资情况看，在债券、基金科目上计提减值损失的可能性不大，即便计提其总量也十分有限。我们将分析重点放在券商的自营股票投资上：从上市券商中报可供出售金融资产投资明细看，中信、海通、宏源、国金等公司可供出售金融资产规模相对较大。我们测算：会计政策变更对中信08 年EPS 的影响为0.09 元，因此我们将公司2008 年EPS 由原先的1.14元下调至1.05 元，由于会计政策变更并不影响现金流，长期而言对公司估值影响中性。",孙健
000651,申万宏源集团股份有限公司,2009-01-12,格力电器(000651)：提升盈利能力 对抗不振需求,https://stock.finance.sina.com.cn/stock/go.php/vReport_Show/kind/search/rptid/285065446061/index.phtml,"公司发布08 年业绩预增公告，预计08 年全年净利润同比增长50%左右达到约19.5 亿元，对应每股收益约1.55 元。公告称，增长主要是公司成本下降，同时具有自主知识产权的高科技新产品销售大幅增加。
业绩预增的净利润高于我们的预期，之前预测每股收益为1.50 元。
我们预计公司08 年全年收入增长基本符合之前的预期，第四季度收入增幅与第三季度收入增幅相当。
但是净利润增幅超过预期，主要原因在于公司产品结构在不断优化的过程中，而且在原材料下降的通道中终端产品价格并未如期下降，毛利率和销售净利润率将继续提升。第四季度的销售净利润率有望达到5%以上，为全年最高的一个季度。
面对空调行业需求不振的现状，公司利用强大的品牌定价优势以及领先创新的研发能力，通过盈利能力的提升来弥补需求不振所带来的缓慢销量增长。
公司08 年和09 年的PE 估值分别为12 倍和10 倍，维持“买入”评级，估值上已经具有吸引力。行业数据转好是估值反弹的支撑，一季度空调行业的数据转好的可能性较小，最早的数据回暖可能出现在二季度。2 月1 日起“家电下乡”全国范围内实施，空调作为下乡家电品种之一亦将受益。最具有三四级市场网络优势的格力将成为行业最受益的公司，如果政策能够加速农村市场的启动，并且带动乡镇级的空调市场维持良好趋势，那么建立在量增基础上的盈利能力提升则会带来更好的增长。",付娟
600115,国金证券股份有限公司,2009-01-12,东方航空(600115)：航油套保巨亏 公司业绩预警,https://stock.finance.sina.com.cn/stock/go.php/vReport_Show/kind/search/rptid/285065130640/index.phtml,"东航航油套保亏损超出市场预期
市场虽然对东航的航油套期保值公允价值变动亏损有所预见，但本次东航公告的航油套期保值公允价值变动亏损金额高达62 亿元，超出市场预期。东航此前在11 月26 日公告，航油套期保值公允价值变动亏损金额为18.3 亿元。
东航此次依然没有公告航油套保的具体合约、期限和金额，因此我们不能准确预测东航在2009 年和2011 年的亏损金额。
东航航油套保的目的和工具
东航公告称，使用航油套期保值业务的目的主要是为了锁定公司的航油成本。东航为航油的实际使用者，当航油价格下跌到超出锁定的下限时，东航在承担支付赔付义务的同时将受惠于航油现货采购成本的降低，一定程度上冲抵公司按照合约所支付的赔付损失，最终达到公司使用航油套期保值业务的目的。
东航航油套期保值期权合约采用的主要结构是上方买入看涨期权价差，同时下方卖出看跌期权，主要原因是利用卖出看跌期权来对冲昂贵的买入看涨期权费，同时要承担市场航油价格下跌到看跌期权锁定的下限以下时的赔付风险。
东航对于航油套期保值交易的会计处理，严格按照《企业会计准则-套期保值》部分的规定计量。将套期保值交易的收入，冲抵航油现货成本。同时对于不符合套期会计的交易公允价值，直接计入当期损益。
东航于2008 年6 月30 日，根据签订的航油期权合约，本集团需以每桶62.35 美元至150 美元的价格购买航油约11,350,000 桶，并以每桶72.35美元至200 美元的价格出售航油约3,000,000 桶。此等合约将于2008 年与2011 年间到期
东航2008 年的套期保值量占2008 年全年预计耗油量的35.9%。我们预计东航2008 年耗油量约为240 万吨，因此，2008 年东航套期保值量约为86万吨。",曾旭
600325,国金证券股份有限公司,2009-01-12,华发股份(600325)：区域经济提振,https://stock.finance.sina.com.cn/stock/go.php/vReport_Show/kind/search/rptid/285065034484/index.phtml,"发改委公布《珠江三角洲地区改革发展规划纲要（2008-2020 年）》，其中明确提出将加快港珠澳大桥建设，将对珠海经济的提振产生深远影响，也为华发股份的房地产业务经营提供了有利的外部环境。
大桥建设无论长短期都会对当地经济发展产生重要影响，短期可通过投资拉动一定程度抵消外部经济减缓的负面影响，长期将彻底改变当地交通格局。
短期拉动投资。虽然大桥建设需要六年时间，但建设期间其对经济的发展将体现在对投资的拉动上。按照规划，大桥的建设将需要总投资375 亿元，内地政府投资占44.5%，也即需要在六年内投资167 亿元，年均27.8亿元，占07 年珠海固定资产投资的7.4%。
建成后将彻底改变珠海交通格局。
珠三角西部地区与香港经济的联系一直受到珠江的阻隔，所以发展速度落后于东部，而港珠澳大桥的落成将改变这一格局。港珠澳大桥全长39.6 公里，计划设计时速为100 公里，建成后香港至珠海的车程将由目前的3－4 个小时缩短至半个小时。珠海西部目前仍有大量工业用地，相比深圳高企的土地价格，解决交通问题后的珠海对境外投资当然会有更强吸引力。
大桥建成后，珠海不仅会成为香港与珠江西部各城市经济往来通道，还会成为连接香港与内地的云南、贵州、四川、广西等省的交通枢纽，经济活动的升温为珠海房地产市场提供良好的宏观环境，就业机会的增加也会吸引更多外来人口置业。
华发不但面临相对有利的宏观经济背景，其自身的发展战略也很好顺应了行业发展趋势，所以目前经营受行业调整产生的负面影响并不明显。首先，公司在07 年并没有高价拿地，而是在市场发生调整的初期就加快推盘实现回款；其次08 年公司融资成功，也使公司可以在目前土地市场低迷的环境中实现低成本扩张。预计公司08、09 年每股收益0.79 元和0.99 元，目前动态市盈率为13.5 和10.8 倍，在同行业公司中尚属低估，建议买入。",曹旭特
000651,东方证券股份有限公司,2009-01-12,格力电器(000651)业绩预增点评：沧海横流方显英雄本色,https://stock.finance.sina.com.cn/stock/go.php/vReport_Show/kind/search/rptid/285064728186/index.phtml,"2008 年以来，我国家用空调行业受房地产成交量大幅下滑、海外需求不振及凉夏等诸多负面因素的影响，销量增速出现下滑，从5 月开始甚至陷入连续7 个月的同比负增长。公司作为行业龙头，逆势而上，三季度销售收入同比增长8.7%的基础上，四季度净利润水平基本没有下降，显示了强大的竞争力。预计2009 年空调行业很难有很明显的好转，但格力电器表现仍将大大好于行业。
格力电器净利润保持快速增长的基础仍然是销售收入稳步增长。在行业面临困境时，众多中小品牌开始退出市场，行业集中度迅速提高。格力电器做为行业绝对龙头，凭借其技术实力、品牌优势和强大的销售网络，市场占有率不断提高，零售量占有率提高3.46 个百分点至22.08%，零售额占有率提升3.86 个百分点至22.36%，行业地位更加巩固。
根据公司的三季度，毛利率得到了显著提升，同时销售费用率也在明显下降。三季度毛利率为20.5%，同比提高1.3 个百分点，销售费用率为11.85%，同比降低约1.1 个百分点。在抵消管理费用率和财务费用率的小幅上升后，两者合计提升营业利润率近2 个百分点。是公司净利润增速大大高于销售收入增速的最主要原因。根据全年业绩预告和行业增长情况，我们预测公司四季度销售销售收入同比将小幅下滑，但净利润率基本维持不变，主要也是来自于净利润率水平的提升。
凭借强大的研发能力，公司新产品占销售收入的比重上半年就突破了20%。新产品的不断丰富和加入是公司毛利率提高的重要原因，也是公司市占率提高的利器。
我们调整格力电器2008 年全年每股收益预测为1.54 元，调整未来两年每股收益至1.75 元和2.32 元。目前股价对应未来08、09 和10 年EPS的估值水平分别为11.85、10.40 和7.81 倍，已经处于历史低位。我们认为相对于2009 年EPS 13x PE 的估值水平较为合理，6 个月目标价为20.76 元，维持“增持”的投资评级。",廖欣宇/张小嘎
600590,中国国际金融股份有限公司,2009-01-12,泰豪科技(600590)股价异动公告、澄清公告及业绩预告,https://stock.finance.sina.com.cn/stock/go.php/vReport_Show/kind/search/rptid/285060788406/index.phtml,当前股价对应09、10年PE分别为14.6x和10.6x，09年PB 1.8x，考虑到配股项目推进可能的摊薄(仍未获得证监会书面批复)，维持7.35元的目标价(对应09PE 16.2x)，上涨空间10.9%。由于增长前景已经明朗，不排除在更好的订单需求下进一步上调盈利预测，仍维持推荐评级。由于短期股价涨幅过高(较我们首次审慎推荐时股价已上涨37%)，不建议客户追高。,朱亚锋
000651,国金证券股份有限公司,2009-01-12,格力电器(000651)：预增基本符合预期 微调后两年盈利预测,https://stock.finance.sina.com.cn/stock/go.php/vReport_Show/kind/search/rptid/285059856608/index.phtml,"我们在1 月5 日的点评《公司进入高新技术企业公示名单，空调下乡将启动》中，已经对公司获得高新技术企业资格后所得税率将下调3 个百分点的影响进行了分析，同时对08 年销售收入进行了调整，综合两方面因素测算出格力电器2008 年的净利润预计为19.27 亿元，每股收益将达到1.539元，但由于公司仍旧处在高新技术企业的公示期，谨慎起见，我们没有调整调整盈利预测，计划待公司披露公示结果后再进行调整。因此本次公司预增公告披露2008 年公司净利润达到约19.50 亿元，其实基本符合我们19.27亿元的预测，略超1%。
公告中说明全年业绩增长的主要原因是公司成本下降，同时具有自主知识产权的高科技新产品销售大幅增长。
这点说明08 年公司销售均价和毛利率得到提高，与我们的预测也相吻合。由于08 年空调行业整体销量同比下滑，公司只能依靠市场份额扩大和销售均价提高来获得增长。我们预计全年公司收入约为432 亿，同比增长13.6%；因此净利润增长50%左右还需依靠毛利率的提高和费用率的下降。
08 年是原材料价格大起大落的一年，上半年在高位继续快速上涨，下半年则转而以惊人速度大幅下跌；在这样的形势下公司的毛利率能够得以继续提高，相信除了高科技新产品销量大增以外，原材料库存控制能够快速反映市场变化也起到了很大的作用。
调整2008-2010 年盈利预测
本次我们主要基于对家用空调行业增速预测的改变调整公司的收入预测（图表1）。",王晓莹
600104,国金证券股份有限公司,2009-01-12,上海汽车(600104)：一只靴子落地,https://stock.finance.sina.com.cn/stock/go.php/vReport_Show/kind/search/rptid/285059824703/index.phtml,"企业回生程序简介：
按照韩国法律规定，企业回生程序是指在法院的主导下，调整股东、债权人等利害关系人的法律关系，促使面临危机的企业恢复经营的一种法定程序，类似于我们通常所说的“破产保护程序”；
法院受理企业回生申请后，认为该企业具有回生可能性的，决定进入企业回生程序。此后，股东、债权人等利害关系人组成的关系人大会审议、决定企业提交的回生计划方案；作为回生计划的一部分，股东的股权有可能部分或全部丧失；债权人也会丧失部分或全部利益；
回生计划方案经关系人大会审议通过后，提交法院认可。法院作出认可决定的，原有股东和债权人的权利依据回生计划方案的规定发生相应变化；
双龙的损失属于“Sunk Cost”，不影响内在价值：
截至11 月30 日，上海汽车拥有韩国双龙权益合计为18.51 亿元，预计双龙汽车08 年亏损对上海汽车的影响接近10 亿元左右，如果双龙汽车进入破产清算，上海汽车最大的投资损失为18.51 亿元，并且已经包含08 年直接亏损10 亿元，因此即使双龙破产，对上汽而言仅仅是“SunkCost”，并不会造成进一步的现金流出，因此我们认为这一事件并不会影响上海汽车的内在价值；
影响短期业绩和净资产，公司股价面临重新修整：
我们预测公司08 年EPS 为0.363 元，每股净资产5.86 元，其中包含对韩国双龙全面亏损10 亿元的预期，按照上海汽车5.83 元收盘价计算，对应PE 和PB 分别为16 倍和1 倍；
如果双龙破产，并且上海汽车在08 年全额计提双龙的投资损失，那么将减少公司08 年业绩0.28 元，新增亏损为8.51 亿元，对应-0.13 元EPS，上海汽车08 年业绩预测可能进一步下调至0.233 元 ，每股净资产下调至5.45 元，目前股价对应PE 和PB 分别为25 倍和1.1 倍，短期内公司股价面临向下修正的可能性；
韩国双龙实乃“鸡肋”，借此机会或可甩掉包袱：
上海汽车收购韩国双龙时的好处在于：1）通过技术引进，丰富上汽自主品牌产品线，尤其是SUV；2）通过产能转移的方式降低双龙的成本、利用韩国双龙在北美和欧洲销售网络的优势，实现双龙汽车的再次腾飞；
到目前这些愿景都难以实施，最重要的原因在于公司对于韩国双龙的控制力没有达到预期：先是双龙工会罢工事件，后又有上汽偷窃双龙核心技术的谣言，即使到目前双龙濒临破产之际，上汽与双龙工会之间的谈判也未达成一致，上海汽车对韩国双龙的实际控制力几乎是不存在的，这也是国际上几次大型汽车行业并购重组失败的最重要原因；
韩国双龙08 年的资金缺口为604 亿韩元，预计09、10 年还需要8 亿美元的营运资金，短期内资金投入规模较大。而公司的产品结构中大排量SUV 业务占主导，并且50%的业务来自于韩国之外的北美和欧洲，在目前高油价和发展小排量轿车的驱使下，双龙对上海汽车的战略意义远远小于当初，短期内也难有翻身的机会；
因此我们认为此次双龙进入破产回生程序对上海反而是利大于弊：1）投资损失额可以控制，上海汽车面临的两大不确定性——韩国双龙和美国通用已经有一只靴子落地；2）双龙破产，则上海汽车可以全身而退；即使企业回升程序启动，上汽也有机会改变对双龙控制力较弱的现状；3）对上汽不利之处在于，如果双龙破产，那么此前双方签订的产品和技术引进协议有可能失效，从而影响上汽自主品牌车型的开发进程；
我们暂不调整公司业绩预测，预计08-10 年EPS 分别为0.363、0.305 和0.397 元，继续关注韩国双龙事件和美国通用的最新动向，并建议投资者关注公司股价因此事件大幅下跌可能带来的投资机会；",李孟滔
002215,东方证券股份有限公司,2009-01-12,诺普信(002215)：政策支持 销售制胜！,https://stock.finance.sina.com.cn/stock/go.php/vReport_Show/kind/search/rptid/285059525062/index.phtml,"国内农药需求将保持稳定。国内农药市场需求与GDP 相关性较小，而与农产品种植面积更为相关。从目前国内情况和政策导向来看，农产品种植面积将保持稳定，再加上近几年病虫害发病面积一直呈上升趋势，预计未来几年国内的农药总需求将保持稳定增长。
农药制剂行业集中度可能迅速提高。2007 年年底至今，国家陆续出台了一系列利于农药制剂行业整合的政策，其中提高新药注册费用以及对新建企业注册资本和环保投入的法规提高了农药制剂行业的进入门槛，影响了农药制剂行业的竞争格局，诺普信等龙头企业将从中受益，借鉴医药商业企业的经验，农药制剂行业的集中度有望迅速提高。
诺普信是国内规模最大的农药制剂企业。公司注册地为深圳，产品包括杀虫剂、杀菌剂、除草剂三大系列，是目前国内规模最大的农药制剂企业，也是国内最大的水基化制剂研发和生产基地，募投项目投产后，公司拥有水基化制剂生产能力近4 万吨，外加其它剂型生产能力，2009 年底公司将拥有各种剂型生产能力6 万吨。
诺普信销售网络下沉策略得当，新增销售人员效果将在2009 年释放。诺普信针对我国幅员辽阔，地理条件、气候条件差异性较大，农作物种类繁多，病虫草害发生情况千差万别等特点，积极施行销售网络下沉策略。我们认为该策略将提高公司的品牌影响力，5000 家基层中心店、50000 家直接服务零售店等目标一旦达成将大幅提高公司的销售能力。我们认为随着新招销售人员的逐步到位，其效益将在2009 年开始体现。
短期内，诺普信毛利率将有所提高。由于农民对农药制剂需求的低弹性诺普信的制剂价格将保持稳定，但由于受油价大幅下跌的影响，其原药成本可能下降。再考虑到新药注册成本提高后，制剂市场新药推出速度可能会受影响，进而可能推高新药毛利，由于公司在2008 年抓住时机注册了200 个左右新产品，近期内其新药推出速度将不受注册费用提高的影响，因此，我们预期诺普信毛利将有所提高。
预计公司08 年、09 年和10 年EPS 分别为0.55 元、0.82 元和1.15 元，给予增持评级。
风险因素：销售网络下沉未收到预期效果，使得公司业绩未能如期增长。",杨云/庄琰/王晶
601919,渤海证券股份有限公司,2009-01-13,中国远洋(601919)：BDI反弹最大的受益者,https://stock.finance.sina.com.cn/stock/go.php/vReport_Show/kind/search/rptid/285175712733/index.phtml,——,齐艳莉
000759,渤海证券股份有限公司,2009-01-13,武汉中百(000759)：成长空间和安全边际搭配高估值,https://stock.finance.sina.com.cn/stock/go.php/vReport_Show/kind/search/rptid/285175653046/index.phtml,"模式可复制和现代零售业快速渗透使超市行业具有广阔的发展前景所售商品需求量弹性小，比百货更具有抗周期性
快消品行业库存压力小，价格变动灵活，零售商能够保持毛利率
食品价格已经趋稳，快速下跌的幅度已经不大，超市的最坏已经过去。
一旦物价反弹，超市收入将迅速提升
城市低收入阶层和农民将成为超市的销售对象
品牌优势、先发优势、战略优 展空间，能够保证公司4-5 年的发展
06、07 年新开超市将在08、09 年进入快速增长期
08-10年盈利年均复合增长率达到26%。
目前估值略高于行业平均，短期内给股价继续上涨带来压制。
但无论从战略、团队、模式的角度，公司都是值得长期持有的品种。长期评级“买入”；",陈慧
