股票代码,券商简称,发布日期,研报标题,报告链接,研报文本,研究员
600030,申万宏源集团股份有限公司,2009-01-21,中信证券(600030)：业绩小幅超越市场预期完全在我们意料之中,https://stock.finance.sina.com.cn/stock/go.php/vReport_Show/kind/search/rptid/285850988734/index.phtml,"公司公告2008年业绩快报：营业收入176.73亿元（VS我们预期173.50亿元）、净利润72.81亿元（VS我们预期69.61亿元）、EPS1.10元（VS我们预期1.05元），ROE13.23%（VS我们预期13.51%）。尽管业绩快报小幅超越我们预期，但我们已在近期的行业报告中提示公司08年业绩低于1.10元的概率很低，因此公司业绩完全在意料之中。
从四季度单季数据看，营业收入37.73亿元（环比26%）、净利润13.83亿元（环比23%），由于四季度日均成交额（822亿元）较三季度（743亿元）高10.6%，四季度业绩环比上升在我们预期之中。我们在前期报告中分析过，公司对可供出售金融资产计提减值损失的会计政策修正实际冲减08年EPS0.08元，如考虑到这一因素，公司业绩超预期的程度可能更大。
我们初步判断：造成2008年业绩小幅超越预期的主要原因可能在于两点：一是因历史上大额费用计提和近期公司降薪所导致的实际营业费用率降低，二是公司注册地迁回深圳后追溯调整导致的所得税率降低。我们将在公司年报正式发布后就相关问题进行进一步分析。
从基本面看，公司的业务和管理战略已经形成一定惯性，但是缺乏短期催化剂（这与2007年有持续的并购、海外扩张、融资等催化剂事件形成明显区别）。此外我们担心华夏和中信基金合并后，股权转让的推进可能使得公司资产管理业务收入占比降低，并降低再投资收益率和估值水平。",孙健
600739,申万宏源集团股份有限公司,2009-01-21,辽宁成大(600739)：广发2008年业绩超出预期、上调2008年盈利预测至1.17元,https://stock.finance.sina.com.cn/stock/go.php/vReport_Show/kind/search/rptid/285850076125/index.phtml,"公司公告业绩快报：全年实现净利润同比下降约50%-60%，折合公司2009年净利润约为8.45亿元到10.56亿元，对应EPS为0.94元到1.17元。我们认为实际EPS应在1.15-1.17元左右，较我们原先预期的1.08元高6.5%到8.3%。
广发2008年净利润超越我们预期：我们原先预期08年广发净利润29.62亿元，由于四季度成交额放大，我们将净利润上调至34亿元（包含已广发华福贡献2.24亿元权益净利润），对应贡献EPS0.98元，同时我们给予生物医药及流通业务0.19元EPS，将2008年盈利预测上调至1.17元。
广发证券四季度单季度净利润为9.68亿元，相对于三季度（6.17亿元）环比上升57%，上升幅度高于中信（23%）和海通（-12%），再次印证了我们在近期行业报告中关于广发证券业绩弹性的论述，公司在几家大券商中弹性最好。
广发上市成为大概率事件：尽管时间上还有一定不确定性，但广发已经成为成大的最大投资主题。上市后，成大将持股广发6.25亿股（占总股本24.93%，每股含0.69股广发），尽管股份仍需锁定3年才能流通，但这并不妨碍我们使用市值法对公司进行估值。
公司其它业务每年可贡献超过0.20元EPS，并保持10%左右的增长：其中商业连锁（家乐福+百安居）每年贡献3000万元净利润（EPS0.03元）、医药连锁业务每年贡献3000万元（EPS0.03元）、我们预测2008年成大生物净利润2亿元（权益净利润1.1亿元，EPS0.12元）。成大生物人用狂犬病疫苗占据国内市场25%左右份额，09年外部市场代理商更换可能将使得成大生物上半年业绩出现波动，但长期增长趋势不改，兽用狂犬病疫苗可望于09年拿到卫生部牌照。
运用分部加总法，给予成大生物医药业务25XPE、流通业务15XPE，成大主业估值约为5元左右。给予广发530亿元的目标市值，每股贡献成大约为15.27元，我们仍维持对成大20元的目标价格和增持评级。
风险提示：公司1月24日有5674万股小非解禁，其中成大集团3206万股、吉富公司2336万股。我们判断成大集团基本无减持可能，而吉富公司减持动力也不大，因此解禁对股价实际冲击相当有限。",孙健
600580,申万宏源集团股份有限公司,2009-01-21,卧龙电气(600580)调研报告：负债率低为资产收购创造条件 存在资产收购的可能性,https://stock.finance.sina.com.cn/stock/go.php/vReport_Show/kind/search/rptid/285850075609/index.phtml,"投资建议：我们预测，公司08、09和10年EPS分别为0.46、0.56和0.72元。09PE和10PE分别为15.9倍和12倍，而行业平均水平为20倍和16.5倍，公司估值属中等偏下。FCFF估值结果显示公司的合理价值在12.7元。考虑到资产收购的可能性，我们建议积极增持。
有别于大众的认识：市场可能认为公司是单纯的电气设备制造企业，而我们认为公司资本收购能力较强，4亿元企业债发行后可能展开收购，将培育新的增长点。
一方面，公司资产负债率低于40%，存货和应收账款管理较好，从而保证了充沛的经营性现金流，为融资收购创造了条件。
另一方面，公司曾先后低价收购灯塔能源和银川变压器厂，并快速培育成为新的增长点。目前，二者合计将占到销售收入（除贸易）的42%，成为支柱业务。
我们认为，公司最近4亿公司债发行获批，为收购资产创造了资金条件。在全国经济增速减缓的2009年，将不难挖掘具有增长潜质而又价格低廉的资产，年内可能进行资产收购。公司原有业务涉及电机和蓄电池生产，我们认为待收购资产的业务范围可能包括：（1）风电电机；（2）电机控制设备；（3）太阳能储能电源，当然，也不排除收购其它相关资产的可能性。
同时，我们认为受3G和铁路电气化投资拉动，基站电源和牵引变压器需求旺盛。公司目前面临的是产能问题，预计随着新增产能的投产，基站电源和牵引变压器仍将保持快速增长。
股价表现的催化剂：公司债发行，资产收购启动。",矫健
002024,申万宏源集团股份有限公司,2009-01-21,苏宁电器(002024)：受消费下滑和假日调整 四季度业绩低于市场预期,https://stock.finance.sina.com.cn/stock/go.php/vReport_Show/kind/search/rptid/285850074640/index.phtml,"苏宁今日发布业绩预增修正公告，公司预计2008年度归属于母公司所有者的净利润比上年同期增长40-50％，该增长比例比三季报预披露的60-80％的增长低了20多个百分点。对此我们的评论是：
1、经济危机和房地产周期对苏宁家电销售的确带来了较深的影响。10月份突然开始的实体经济停滞目前已迅速蔓延到了终端消费领域，百货、家电和奢侈品消费都出现了不同程度的下滑，而受房地产成交量的持续萎缩，家电消费出现了较大的滑坡，10-12月份，宏观家电消费增长的速度平均仅保持在个位数左右。
2、节假日调整也同样影响了公司四季度的业绩增速。08年元旦因为有两天的假期前置至07年四季度，造成07年四季度利润基数虚高，另外，08年国庆也有三天假期前置至三季度，造成三季度增长偏高，四季度增长偏低。同样的季节性理由，我们认为苏宁09年一季度仍有望重新踏上16％的正增长，原因是08年元旦基数较低，而09年元旦30亿元的销售收入全部归于一季度的增长。
3、根据公司公告全年增长40-50％，我们预计同比增长为43.85％，而前三季度净利润为4.31亿、6.7亿和6.11亿，同比增长67.1％、72.5％和56.2％，推算下来四季度净利润为3.96亿元左右，同比下降7.5％。该负增长一方面反映了实体消费的糟糕表现，另一方面也需要结合季节性因素理性看待。
4、从行业竞争格局看，苏宁的相对竞争优势益发明显，在华东市场的绝对领先地位进一步突出，在其它市场与国美的差距也逐步缩小。元旦及近期国美的销售情况不容乐观，草根调研的结果是卖场门店货源不畅、销售乏力，并且从供应商方面了解看，国美的现金流较为紧张。我们看好苏宁在未来长周期中的最后胜出！
短期来看，家电销售的压力依然存在，特别是09年上半年，房地产周期尚未明朗，因此我们下调苏宁未来三年的盈利预测，预计08-10年，公司将可实现净利润21.08亿元、24.53亿元和27.86亿元，同比增长43.85％、16.37％和13.58％，实现每股收益0.7元、0.82元和0.93元，目前股价对应的估值分别为25倍、21倍和19倍。我们不认为苏宁股价没有上涨空间，08年四季度应该是苏宁业绩增长的低点，09年的重新恢复增长将成为公司股价上涨的催化剂，我们维持买入的投资评级。
苏宁还同时披露了2008-2009年的开店情况，08年新开210家门店，置换30家，实际新开180家，年末门店数量为812家，公司计划09年新开200家左右，不过由于宏观经济依然疲弱，苏宁可能会置换或关闭一些经营业绩不佳的门店，我们估计大约在30家左右，因此实际新开可能在170家左右。",金泽斐
600831,中国银河证券股份有限公司,2009-01-21,广电网络(600831)：受益通缩和渠道垄断 高速成长值得期待,https://stock.finance.sina.com.cn/stock/go.php/vReport_Show/kind/search/rptid/285850074140/index.phtml,"有线网络行业的渠道垄断性和弱周期性。 广电网络的收入和经营性现金流不受经济周期影响, 主要业务防御性特征明显, 与此同时, 有线网络用户规模还能保持每年25-30万的增长。
通缩受益者。 机顶盒价格下降推动数字电视转换的资本开支大幅降低, 基本收视费提价使得数字电视转换成为公司业绩增长的引擎。
收购整合完成、经营机制理顺。 公司新一届管理团队经验丰富、锐意进取, 在建立现代化企业管理体制和先进的企业运营机制方面已经有清晰的思路和积极的尝试, 同时还在努力争取地方政府更多的税收和财政补贴等优惠政策，公司有望进入良性发展的轨道。
盈利能力提升空间巨大。广电网络在用户规模、收视费提价和政府政策支持方面都有优势, 而广电网络950元/户的户均价值和6%的净利率远低于行业平均水平。随着数字电视转换的推进和管理体系的改善, 我们预计公司2010年的净利率水平将提升到16%。
估值与投资建议。 从PE和PB的角度分析, 广电网络是估值最低的传媒类公司, 同时未来的成长最具有可预测性。 有线网络运营公司一直享有高于市场平均的估值水平, 我们以09年30倍PE或者10倍EV/EBITDA计算, 公司合理的相对估值水平为10.8元。根据我们的DCF模型, 在WACC=10.03%和G=1%的假设下, 广电网络的绝对估值水平为13.86元。
主要风险。卫星电视在城市落地的限制放开; 未能获得免税优惠政策; 较低的08年业绩的披露",许耀文
600030,中国银河证券股份有限公司,2009-01-21,中信证券(600030)：业绩快报点评,https://stock.finance.sina.com.cn/stock/go.php/vReport_Show/kind/search/rptid/285849480328/index.phtml,"投资建议
我们暂不调整2009、2010年业绩预测。我们对未来两年股票日均交易额的基本假设分别为670亿元和1000亿元，预计中信证券2009/2010年净利润为52.42/75.14亿元，每股收益为0.79/1.13元（详细数据见表2）。在宏观经济形势恶化与经济刺激政策的博弈下，证券股股价在股票市场震荡的带动下波动性也将加强，这给投资者带来波段交易的机会。我们认为，短期看，中信证券估值的安全底线位于16.6元（对应2倍PB），估值上线位于24.25元（对应09年25倍PE）。",迟晓辉
600348,渤海证券股份有限公司,2009-01-21,国阳新能(600348)：静待集团资产注入,https://stock.finance.sina.com.cn/stock/go.php/vReport_Show/kind/search/rptid/285849347343/index.phtml,"煤炭产品多元化组合，有利于应对系统性风险
公司是无烟煤行业龙头企业之一，煤炭生产-→加工-→销售模式，自产连同集团生产原煤全部入洗，洗出洗块煤（15%）、喷吹煤（15%）及洗末煤（70%），分别用于化工、冶金、电力及建材等行业，其中洗块煤和喷吹煤产品市场盈利能力较强。  ? 短期公司内生性的产量提升来自于开元矿、平舒煤业   08年4月份向集团收购的开元矿，控股子公司平舒煤业（持股比例为56.31%），总产能近2000万吨，预计开元矿08年产量为300万吨，平舒煤业产量为50万吨。
静待集团资产注入--经营改善的关键   集团与上市公司之间大额的关联交易不利于上市公司长期快速的发展，开元矿的收购开启了集团资产注入的序幕。目前上市公司代为托管集团的三个矿，除三矿（濒临资源枯竭，面临破产境地）外，五矿、新景矿，将是优先注入的资产。
09年公司业绩面临下调的风险
宏观经济景气迅速下滑， 煤炭价格下调仍在继续，公司所属煤种为无烟煤、喷吹煤子行业，市场化程度较高，故而受市场波动的风险较大。
给以公司""买入""的投资评级
未考虑集团进一步资产注入的情况，考虑到公司现有资产的情况，以及未来产品价格可能的走势，对公司未来三年做出盈利预测，预计公司08年、09年和10年每股收益为1.236元、0.899元和1.004元。利用DCF估值，公司股价价值为16.93元/股。目前公司解决与集团关联交易的决心较大，这也将成为09年最大的投资亮点，给以公司""买入""的评级，目标价15.0元。",张顺
002129,光大证券股份有限公司,2009-01-21,中环股份(002129)：逆势成长的太阳能新军,https://stock.finance.sina.com.cn/stock/go.php/vReport_Show/kind/search/rptid/285849345718/index.phtml,"环欧公司入选2008 年国家鼓励的集成电路企业，有助于抵御行业波动
发改委等部门2008 年共批准认定的国家鼓励的集成电路企业共31 家，环欧公司作为其中之一，未来的国家及地方政府对集成电路企业优惠政策的出台将对公司产生积极作用。从对国家未来电子产业政策的理解来看，扶持优质企业做大做强是政策的重要思路。本次入选使得公司可以受惠于未来的政策支持，有助于抵御行业目前的波动。
太阳能行业波动变大，战略长单保证公司逆势成长
太阳能行业整体目前受全球经济衰退的影响较大，行业从三季度起出现了较大的下滑，这对主要太阳能公司均构成了一定的影响，市场对太阳能行业整体09 年看法悲观，但我们认为公司09 年有望逆势成长。这主要依赖于公司之前的战略长单，其将能够保证公司业绩的稳定性：在08 年5 月、7 月分别与上游顺大和下游展丰签订了多晶硅采购和太阳能硅片供应长单之后，公司已经基本锁定了多晶硅市场波动的风险。该长单的收入有望占到公司09 年直拉单晶硅业务收入的65%以上。这为公司业绩的增长奠定了基础，目前太阳能市场的利润已占公司利润的接近40%。
占公司利润来源的40%左右的区熔单晶硅在铁路机车、输配电、新能源等市场的推动下，波动性相对较小，该部分业务09 年仍有望保持20%左右的增长。
环欧的硅材料是公司的看点，未来向太阳能扩展将提升公司估值
环欧的硅材料业务目前为公司贡献了92%以上的利润，未来向太阳能领域的自然延伸值得期待，这也将提升公司的估值水平。目前市场对公司的估值与电子器件行业一致，这主要是受其MOSFET 业务进展不如预期的影响。我们认为MOSFET业务09 年利润贡献仍将很小，其主要价值在于可以完善公司的上下游产业链，抵御未来的行业波动。从公司签订的长期合同来看，未来向太阳能市场的大幅度扩张将是必然之举，未来的进一步行动值得关注。
太阳能行业波动是最大风险，公司增长确定性强，维持买入评级
太阳能行业未来将有个大浪淘沙的过程，在良好的战略及有雄厚实力的大股东支持下，公司仍有望取得长足的发展。公司09 年业绩增长明确，但10 年我们作保守估计，其增速将有所下滑并在11 年重新恢复高速成长。维持买入评级不变。",谢锋/周励谦
600087,中国国际金融股份有限公司,2009-01-21,长航油运(600087)：08年业绩预增70% 完全符合预期,https://stock.finance.sina.com.cn/stock/go.php/vReport_Show/kind/search/rptid/285849344905/index.phtml,"由于油轮市场运价的提高、公司运力扩张和07年底进行的资产注入，08年扣除非经常性损益后的业绩增长50%以上。1）08年油轮整体的高运价是全年业绩增长的主要因素之一：以WS中东到日本的VLCC运价指数为例，原油轮运价同比增长60%；以新加坡到日本的MR运价指数为例，成品油轮运价同比增长13%。
2）08年部分船型的运力的扩张也带动了业绩的增长：08年公司MR油轮的有效运力从11艘增长至17艘，阿芙拉油轮的有效运力从1艘增长到3艘（表3）。3）资产注入也是全年业绩大幅增长的另一个主要因素：公司07年以非公开发行的方式注入了海上油运业务资产，该部分资产07年度仅贡献了11和12月两个月的利润，而08年贡献了全年利润。
08年净利润同比增长70%左右，为每股收益0.37元，其中出售船舶估计贡献了大约0.14元。公司在08年上半年出售旧船贡献了1.79亿元的营业外收入，下半年公告的五艘旧船出售也贡献了约0.49亿元的收益，合计相当于贡献了摊薄后每股收益0.14元。
08年四季度业绩环比有所下滑。扣除卖船的非经常性损益后，公司三季度的每股收益约0.06元，而经粗略估计四季度大约只有0.05元左右。四季度业绩有所下滑的主要原因是市场运价的走低（表2）。
运价持续低位将给09年业绩带来不利影响，09年盈利存在下调风险。我们目前假设公司旗下VLCC实际实现的运价在09年和2010分别下跌20%和上涨25%，而MR运价09年和2010则能分别小幅上涨5%（表7）。如果市场运价持续走低，那么公司09年能够实现的运价也将低于我们的假设，09年盈利也还有下调空间。
运力的迅猛扩张将抵销运价下跌的部分负面影响，暂时维持盈利预测不变。预计09年至2011年的有效运力分别同比扩张139%、33%和58%，其中以VLCC和MR两种船型的扩张最为迅猛（表6）。由于运力增长迅速，所以即使09年运价有所下滑，如果下滑幅度不大，则当年的盈利仍将有所增长。依据我们目前的预测，09至2010年的每股收益将分别同比增长7%和61%。由于目前披露信息有限，我们暂维持09年盈利预测不变。
公司的财务和运价波动风险偏高。考虑表外负债后07年底的负债率达到72%；公司未来三年有约19亿元的资金缺口，预计09年将有再融资需求，若不能成功再融资，公司可能会出售部分订单，从而影响未来盈利增速。由于油轮运作基本采用即期市场模式，运价波动10%，公司盈利将波动20-21%（表3），敏感性较高，因此一旦运价低于预期，公司业绩也将受到较大影响。
维持""中性""评级不变，最佳投资机会未至。1）目前股价对应09年市净率与国际可比公司大致相当，但是由于公司的净资产收益率较低，因此09年的市盈率则明显高于国际可比公司，因此目前估值仍相对较高。2）另外，航运公司股价与运价的相关性较大，而鉴于我们判断09年底前运价处于低位，预计长航油运的股价在09年底前也难以有较好表现。基于上述两点，我们维持""中性""评级不变。如果09年底到2010年的油轮运价如我们所预期那样有所反弹的话，我们认为届时将可以适当投资长航油运，而目前并非最佳投资机会。",杨鑫
002187,广发证券股份有限公司(2010-02-09合并前),2009-01-21,广百股份(002187)调研简报：收购物业保证公司09年业绩增长,https://stock.finance.sina.com.cn/stock/go.php/vReport_Show/kind/search/rptid/285849344093/index.phtml,"投资建议
基于公司收购物业，我们预计公司2008-2010年EPS为0.81、1.00和1.24元。由于公司09年业绩增长确定，在行业09年一季度销售压力较大，业绩增长确定性较差的情况下，公司确定的业绩增长给投资者的安全边际较高，且公司整体扩张将较为有序，未来成长性可以期待。我们上调公司评级至买入，对应09年25倍PE，目标价25元。",欧亚菲
600327,国投证券股份有限公司,2009-01-21,大厦股份(600327)：09年增长归于平淡,https://stock.finance.sina.com.cn/stock/go.php/vReport_Show/kind/search/rptid/285848933764/index.phtml,"四季度和元旦百货销售情况：预计四季度百货销售收入同比增长在25%-30%之间，毛利率将下降到21%以下。12月份大厦促销活动导致当月销售毛利率下降到19%左右，毛利率耗损在2个点左右。09年元旦促销效果明显，元旦假期1.1-1.5日大厦的销售收入（税前）已经超过1个亿。
09年百货业务利润相比08年增长有限
正面因素：09年是公司结束改装的第一个完整经营的会计年度，费用摊销压力逐渐减轻。负面因素：（1）修地铁影响路面交通：地铁三阳广场站预计09年3月份之前开工，开工对路面交通的影响时间大约为一年半。施工对中山路上的主要百货店的客流都将产生负面影响，不存在明显的替代和分流现象，但仍不利于公司销售。（2）竞争激烈，八佰伴重新开业：无锡八佰伴A座已陆续营业，基本改造完毕。B座预计09年9月完工，完工后合计建筑面积将达到12万平米，除了百货经营外还包括更多餐饮，势必对大厦造成一定的客户分流。
其他业务利润基本打平。公司持有78.81%股权的吟春商贸08年9月份物业已经开始对外出租，预计09年吟春大厦对外出租收入将达到1200万左右，每股收益增加大约2分钱。东方汽车集团08年汽车销量下滑，销售收入同比增长可能为负，但汽车后服务环节的抗周期性使08年汽车业务利润可能同比有5%-10%的增长。09年汽车销售仍然面临着很大的压力，业绩改善比较困难。
盈利预测与投资建议。我们微调09和2010年每股收益至0.44、0.52元，对应PE分别为14.5、12.4倍。公司主业为二线城市的单体百货店，外延增长的空间有限，百货业务营业面积增加带来的业绩爆发主要体现在08年，09年和2010年的增长将归于平淡。核心商圈的充沛客流、改装后经营逐步稳定、后续无重大资本支出三因素仍使公司具有较好的防御性，给予公司增持-B的投资评级。",储丽雯
